{
  "schema_version": "0.9",
  "algorithm": "Ed25519",
  "public_key": "b82f0412b80a7c3f567fb44075d13fe4117385e5be537d6e8dce209e5367e656",
  "signature": "3a19814ba144f72ef5029630f7d771d20c489dd20a102962f3574b06090dc29f77b4d5dae30fcac1b0298a43f0f3375875ee949f64e4c68e6c5d49033ef4f20b",
  "signing_payload": "REPLAYFIX-ATTESTATION:v0.9:0.9:8cdec4881c5e955ec08dea2f51c36c68c2276efc5a70a5038f59197fb298b8e6:8:2026-10-30T15:18:40.389Z",
  "created_at": "2026-10-30T15:18:40.389Z"
}
