{
  "schema_version": "0.9",
  "algorithm": "Ed25519",
  "public_key": "b954c7bb6a0820a7b14f0b94b75b9edd0c9a1b1094e2643320e97ba6362047ea",
  "signature": "ffe409132233cf871565c5db48eb9bac53a68dc61175fba353a6b22ce3bafe1abc5d32bbf7d769731b1551f68bb61f5ee2e3c46bde921deb6a31d2c90b20e005",
  "signing_payload": "REPLAYFIX-ATTESTATION:v0.9:0.9:24a236abd932058cae838a920123a68d8726b87bd9ed76386d24cf9b56b13683:8:2026-10-30T15:21:27.371Z",
  "created_at": "2026-10-30T15:21:27.371Z"
}
